Catégorie,article_id,Titre,Image,Resumé
Afrique,AF001,BRVM : investir en Afrique de l'Ouest,BRVM : investir en Afrique de l'Ouest,Découvrez comment profiter de la croissance économique ouest-africaine grâce à la Bourse Régionale des Valeurs Mobilières
Afrique,AF002,Comment construire un portefeuille diversifié BRVM ?,Comment construire un portefeuille diversifié BRVM ?,Découvrez les stratégies pour investir en Bourse Régionale des Valeurs Mobilières
Afrique,AF003,Comment fonctionne le compte titre BRVM pour les particuliers ?,Comment fonctionne le compte titre BRVM pour les particuliers ?,Tout savoir pour investir en bourse dans les pays de l'UEMOA
Afrique,AF004,Comment gérer ses revenus,Comment gérer ses revenus,Des stratégies adaptées aux réalités économiques africaines
Afrique,AF005,Comment investir en Bourse sur la BRVM ?,Comment investir en Bourse sur la BRVM ?,Découvrez comment accéder à la Bourse Régionale des Valeurs Mobilières sans intermédiaires privilégiés
Afrique,AF006,Comment les diasporas africaines investissent-elles dans les marchés africains ?,Comment les diasporas africaines investissent-elles dans les marchés africains ?,"Les diasporas africaines, moteurs de développement économique et transformation des économies locales"
Afrique,AF007,Comprendre le calendrier boursier de la BRVM,Comprendre le calendrier boursier de la BRVM,Maîtrisez les rythmes de la BRVM
Afrique,AF008,La fiscalité des revenus de la BRVM,La fiscalité des revenus de la BRVM,Guide complet avec simulateur pour calculer vos impôts sur dividendes et plus-values
Afrique,AF009,Le rôle de la BCEAO dans la régulation du marché financier UEMOA,Le rôle de la BCEAO dans la régulation du marché financier UEMOA,Analyse de la gouvernance monétaire et de la supervision financière dans l'espace ouest-africain
Afrique,AF010,Les erreurs fréquentes des débutants sur la BRVM,Les erreurs fréquentes des débutants sur la BRVM,Guide pour éviter les pièges courants à la Bourse Régionale des Valeurs Mobilières
Afrique,AF011,Les ETF Afrique : une solution pour investir facilement ?,Les ETF Afrique : une solution pour investir facilement ?,Croissance Économique et Opportunités d'Investissement
Afrique,AF012,Les Indices de la BRVM,Les Indices de la BRVM,"BRVM 10, Composite et Prestige - Analyse approfondie des principaux indices boursiers ouest-africains"
Afrique,AF013,Les intérêts composés,Les intérêts composés,Votre Argent Travaille Pour Vous
Afrique,AF014,Les livrets d'épargne en cote d'ivoire,Les livrets d'épargne en cote d'ivoire,Comparatif indépendant des solutions d'épargne disponibles
Afrique,AF015,Panorama des grandes entreprises cotées en Afrique,Panorama des grandes entreprises cotées en Afrique,Analyse des leaders économiques et opportunités d'investissement sur les marchés boursiers africains
Afrique,AF016,Qu'est-ce que la BRVM ?,Qu'est-ce que la BRVM ?,"Plateforme financière commune de l'Afrique de l'Ouest : fonctionnement, opportunités et perspectives"
Afrique,AF017,Quelle stratégie pour débuter en investissant sur la BRVM ?,Quelle stratégie pour débuter en investissant sur la BRVM ?,Guide pratique pour investir en bourse en Afrique de l'Ouest
Afrique,AF018,Quels secteurs sont représentés à la BRVM ?,Quels secteurs sont représentés à la BRVM ?,Diversification économique de la bourse ouest-africaine
Afrique,AF019,Quels sont les risques spécifiques de la BRVM ?,Quels sont les risques spécifiques de la BRVM ?,Analyse approfondie des vulnérabilités de la Bourse Régionale des Valeurs Mobilières en Afrique de l'Ouest
Afrique,AF020,Règle des 50_30_20 _ gérez votre budget.,Règle des 50_30_20 _ gérez votre budget.,Une méthode simple pour gérer votre budget
Afrique,AF021,Rentabilité Historique des Marchés Boursiers,Rentabilité Historique des Marchés Boursiers,Analyse des performances cumulées à long terme et perspectives d'investissement
Afrique,AF022,Zone franc CFA : avantages et critiques pour l’investissement,Zone franc CFA : avantages et critiques pour l’investissement,"Analyse approfondie d'un système monétaire unique et de ses implications économiques
"
Europe,EU001,Assurance vie,Assurance vie,Le placement préféré des Français
Europe,EU002,Bourse vs Inflation - Reprendre le contrôle de vos finances,Bourse vs Inflation - Reprendre le contrôle de vos finances,Comment protéger votre épargne et faire fructifier votre capital
Europe,EU003,Combien rapportent 200 euros placés par mois ?,Combien rapportent 200 euros placés par mois ?,Découvrez comment 200€ placés mensuellement peuvent transformer votre avenir financier
Europe,EU004,Comment acheter des actions ? Le guide ultime 2025,Comment acheter des actions ? Le guide ultime 2025,
Europe,EU005,Comment gérer son budget étape par étape,Comment gérer son budget étape par étape,Le guide complet pour prendre le contrôle de vos finances personnelles
Europe,EU006,Comment investir en bourse ? Le guide 2025,Comment investir en bourse ? Le guide 2025,"Les clés pour investir sereinement en bourse en 2025
"
Europe,EU007,Épargne de précaution : pourquoi est ce indispensable ?,Épargne de précaution : pourquoi est ce indispensable ?,Votre sécurité financière commence par une épargne de précaution
Europe,EU008,ETF à réplication synthétique,ETF à réplication synthétique,"Comprendre leur fonctionnement, avantages et risques pour optimiser votre stratégie d'investissement"
Europe,EU009,ETF Dividendes : faut-il investir ?,ETF Dividendes : faut-il investir ?,"Analyse complète des opportunités, risques et stratégies pour générer des revenus passifs"
Europe,EU010,Investir son argent : les 6 erreurs à éviter,Investir son argent : les 6 erreurs à éviter,Évitez ces pièges pour maximiser vos investissements
Europe,EU011,La psychologie des investisseurs,La psychologie des investisseurs,Comprendre la psychologie pour maîtriser vos investissements
Europe,EU012,Les ETF,Les ETF,L'investissement diversifié accessible à tous
Europe,EU013,"Les ETF, la nouvelle bulle ?","Les ETF, la nouvelle bulle ?",ETF : entre révolution financière et risque de bulle spéculative
Europe,EU014,Les frais,Les frais,Comprendre et minimiser les coûts pour maximiser vos rendements
Europe,EU015,Les intérêts composés,Les intérêts composés,Les intérêts composés : votre meilleur allié pour bâtir un patrimoine
Europe,EU016,Les Livrets d'épargne,Les Livrets d'épargne,Le Guide Complet pour Optimiser Votre Épargne
Europe,EU017,Les types d'investissement et supports pour investir en Bourse,Les types d'investissement et supports pour investir en Bourse,Guide complet des différents investissements boursiers et supports disponibles
Europe,EU018,Livret A vs PEA,Livret A vs PEA,Découvrez quel placement est le plus avantageux selon votre profil et vos objectifs financiers
Europe,EU019,Mon plan d'action en 7 jours pour reprendre le contrôle de vos finances,Mon plan d'action en 7 jours pour reprendre le contrôle de vos finances,Prenez le contrôle de vos finances en une semaine seulement
Europe,EU020,Partir à la retraite à 40 ans : le guide parfait pour la frugalité et le mouvement FIRE,Partir à la retraite à 40 ans : le guide parfait pour la frugalité et le mouvement FIRE,Découvrez comment atteindre l'indépendance financière et prendre votre retraite anticipée grâce au mouvement FIRE
Europe,EU021,PEA ou compte titres en 2025 : lequel choisir ?,PEA ou compte titres en 2025 : lequel choisir ?,Comparaison PEA et Compte Titres : optimisez vos investissements en 2025
Europe,EU022,Qu'est-ce qu'un ETF profilé? Guide complet,Qu'est-ce qu'un ETF profilé? Guide complet,"Investir comme un professionnel devient possible, même sans analyser des graphiques boursiers ou gérer des dizaines d'ETF"
Europe,EU023,Quel placement financier sans risque choisir ?,Quel placement financier sans risque choisir ?,Découvrez les meilleurs placements sécurisés pour préserver votre capital tout en générant des revenus
Europe,EU024,Quelle est la fiscalité du PEA en 2025 ?,Quelle est la fiscalité du PEA en 2025 ?,Fiscalité du PEA en 2025 : le guide complet
Europe,EU025,Quelle retraite pour un salaire de 2000 euros nets ?,Quelle retraite pour un salaire de 2000 euros nets ?,Découvrez combien vous percevrez avec un salaire net de 2000€
Europe,EU026,Quelle retraite pour un salaire de 4000 euros nets ?,Quelle retraite pour un salaire de 4000 euros nets ?,Découvrez combien vous percevrez avec un salaire net de 4000€
Europe,EU027,Règle des 50_30_20 _ gérez votre budget.,Règle des 50_30_20 _ gérez votre budget.,Une méthode simple pour gérer votre budget
Europe,EU028,Rentabilité Historique des Marchés Boursiers,Rentabilité Historique des Marchés Boursiers,Analyse des performances cumulées à long terme et perspectives d'investissement
Europe,EU029,Sélection des meilleurs ETF européens en 2025,Sélection des meilleurs ETF européens en 2025,Guide complet pour investir intelligemment dans les ETF en 2025